{
  "committed_facts": {
    "always_invariants": [],
    "assumes": [
      {"atype":"boolean","name":"timer_expired","provenance":"user_stated"},
      {
	"atype":"boolean",
	"name":"pedestrian_request",
	"provenance":"user_stated"
      }
    ],
    "constants": [
      {
	"ctype":"integer",
	"cvalue":30,
	"name":"cycle_time",
	"provenance":"user_stated"
      }
    ],
    "definitions": [],
    "guarantees": [
      {
	"default": {"provenance":"user_stated","value": {"kind":"value","value":null}},
	"gtype":"{red, yellow, green}",
	"name":"light_color",
	"provenance":"user_stated"
      },
      {
	"default": {"provenance":"user_stated","value": {"kind":"value","value":null}},
	"gtype":"boolean",
	"name":"walk_signal",
	"provenance":"user_stated"
      }
    ],
    "initial_mode": {"provenance":"user_confirmed","value":"Green"},
    "modes": [],
    "schema_version":"0.1",
    "system_name":"traffic_light_controller",
    "variables": []
  },
  "diagnostics": [
    {
      "code":"unconfirmed",
      "location": {"kind":"transition","name":"Green_1","transition_idx":null},
      "message":"LLM inferred transition 'Green_1'",
      "severity":"warning"
    },
    {
      "code":"unconfirmed",
      "location": {"kind":"transition","name":"Green_2","transition_idx":null},
      "message":"LLM inferred transition 'Green_2'",
      "severity":"warning"
    },
    {
      "code":"unconfirmed",
      "location": {"kind":"transition","name":"Yellow_1","transition_idx":null},
      "message":"LLM inferred transition 'Yellow_1'",
      "severity":"warning"
    },
    {
      "code":"unconfirmed",
      "location": {"kind":"transition","name":"Yellow_2","transition_idx":null},
      "message":"LLM inferred transition 'Yellow_2'",
      "severity":"warning"
    },
    {
      "code":"unconfirmed",
      "location": {"kind":"transition","name":"Red_1","transition_idx":null},
      "message":"LLM inferred transition 'Red_1'",
      "severity":"warning"
    },
    {
      "code":"unconfirmed",
      "location": {"kind":"transition","name":"Red_2","transition_idx":null},
      "message":"LLM inferred transition 'Red_2'",
      "severity":"warning"
    },
    {
      "code":"unused",
      "location": {"kind":"assume","name":"pedestrian_request","transition_idx":null},
      "message":"assume 'pedestrian_request' is declared but never referenced",
      "severity":"warning"
    },
    {
      "code":"unused",
      "location": {"kind":"constant","name":"cycle_time","transition_idx":null},
      "message":"constant 'cycle_time' is declared but never referenced",
      "severity":"warning"
    }
  ],
  "pending_facts": {
    "always_invariants": [],
    "assumes": [],
    "constants": [],
    "definitions": [],
    "guarantees": [],
    "initial_mode":null,
    "modes": [
      {
	"entry_actions": [],
	"invariants": [],
	"name":"Green",
	"provenance":"user_stated",
	"transitions": [
	  {
	    "actions": [
	      {
		"kind":"set",
		"name":"light_color",
		"value": {"kind":"string","value":"yellow"}
	      },
	      {
		"kind":"set",
		"name":"walk_signal",
		"value": {"kind":"bool","value":false}
	      }
	    ],
	    "guard": {
	      "when": {
		"expr": {"kind":"var","name":"timer_expired"},
		"kind":"is_true"
	      }
	    },
	    "target": {"transition_to":"Yellow"}
	  },
	  {
	    "actions": [
	      {"kind":"hold","name":"light_color"},
	      {"kind":"hold","name":"walk_signal"}
	    ],
	    "guard": {"otherwise":true},
	    "target": {"remain":true}
	  }
	]
      },
      {
	"entry_actions": [],
	"invariants": [],
	"name":"Yellow",
	"provenance":"user_stated",
	"transitions": [
	  {
	    "actions": [
	      {
		"kind":"set",
		"name":"light_color",
		"value": {"kind":"string","value":"red"}
	      },
	      {
		"kind":"set",
		"name":"walk_signal",
		"value": {"kind":"bool","value":true}
	      }
	    ],
	    "guard": {
	      "when": {
		"expr": {"kind":"var","name":"timer_expired"},
		"kind":"is_true"
	      }
	    },
	    "target": {"transition_to":"Red"}
	  },
	  {
	    "actions": [
	      {"kind":"hold","name":"light_color"},
	      {"kind":"hold","name":"walk_signal"}
	    ],
	    "guard": {"otherwise":true},
	    "target": {"remain":true}
	  }
	]
      },
      {
	"entry_actions": [],
	"invariants": [],
	"name":"Red",
	"provenance":"user_stated",
	"transitions": [
	  {
	    "actions": [
	      {
		"kind":"set",
		"name":"light_color",
		"value": {"kind":"string","value":"green"}
	      },
	      {
		"kind":"set",
		"name":"walk_signal",
		"value": {"kind":"bool","value":false}
	      }
	    ],
	    "guard": {
	      "when": {
		"expr": {"kind":"var","name":"timer_expired"},
		"kind":"is_true"
	      }
	    },
	    "target": {"transition_to":"Green"}
	  },
	  {
	    "actions": [
	      {"kind":"hold","name":"light_color"},
	      {"kind":"hold","name":"walk_signal"}
	    ],
	    "guard": {"otherwise":true},
	    "target": {"remain":true}
	  }
	]
      }
    ],
    "schema_version":"0.1",
    "system_name":null,
    "variables": []
  },
  "questions": [
    {
      "category":"confirm_inference",
      "question_id":"repair_confirm_Green_1",
      "relates_to":"Green_1",
      "suggested_options": ["Yes", "No" ],
      "text":"The LLM inferred transition 'Green_1'. Is this correct?"
    },
    {
      "category":"confirm_inference",
      "question_id":"repair_confirm_Green_2",
      "relates_to":"Green_2",
      "suggested_options": ["Yes", "No" ],
      "text":"The LLM inferred transition 'Green_2'. Is this correct?"
    },
    {
      "category":"confirm_inference",
      "question_id":"repair_confirm_Yellow_1",
      "relates_to":"Yellow_1",
      "suggested_options": ["Yes", "No" ],
      "text":"The LLM inferred transition 'Yellow_1'. Is this correct?"
    },
    {
      "category":"confirm_inference",
      "question_id":"repair_confirm_Yellow_2",
      "relates_to":"Yellow_2",
      "suggested_options": ["Yes", "No" ],
      "text":"The LLM inferred transition 'Yellow_2'. Is this correct?"
    },
    {
      "category":"confirm_inference",
      "question_id":"repair_confirm_Red_1",
      "relates_to":"Red_1",
      "suggested_options": ["Yes", "No" ],
      "text":"The LLM inferred transition 'Red_1'. Is this correct?"
    },
    {
      "category":"confirm_inference",
      "question_id":"repair_confirm_Red_2",
      "relates_to":"Red_2",
      "suggested_options": ["Yes", "No" ],
      "text":"The LLM inferred transition 'Red_2'. Is this correct?"
    }
  ],
  "repairs": [
    {
      "action": {"action":"ask_user","name":"Green_1"},
      "for_diagnostic":"unconfirmed(Green_1,transition)",
      "provenance":"rule_derived",
      "requires_confirmation":true
    },
    {
      "action": {"action":"ask_user","name":"Green_2"},
      "for_diagnostic":"unconfirmed(Green_2,transition)",
      "provenance":"rule_derived",
      "requires_confirmation":true
    },
    {
      "action": {"action":"ask_user","name":"Yellow_1"},
      "for_diagnostic":"unconfirmed(Yellow_1,transition)",
      "provenance":"rule_derived",
      "requires_confirmation":true
    },
    {
      "action": {"action":"ask_user","name":"Yellow_2"},
      "for_diagnostic":"unconfirmed(Yellow_2,transition)",
      "provenance":"rule_derived",
      "requires_confirmation":true
    },
    {
      "action": {"action":"ask_user","name":"Red_1"},
      "for_diagnostic":"unconfirmed(Red_1,transition)",
      "provenance":"rule_derived",
      "requires_confirmation":true
    },
    {
      "action": {"action":"ask_user","name":"Red_2"},
      "for_diagnostic":"unconfirmed(Red_2,transition)",
      "provenance":"rule_derived",
      "requires_confirmation":true
    }
  ],
  "schema_version":"0.1",
  "status":"incomplete"
}